id,bid,user_id,用户昵称,微博正文,头条文章url,发布位置,艾特用户,话题,转发数,评论数,点赞数,发布时间,发布工具,微博图片url,微博视频url,retweet_id,ip,user_authentication,会员类型,会员等级
5239130653986597,QgpXXgJ5X,7995859801,兰花螳螂王,#外交部回应日本歌手演唱会被取消#当日本歌手在上海演唱中途突遭断电、滨崎步万人演唱会临开场24小时取消等事件密集爆发后，外交部12月1日以“建议向主办方了解”回应国际媒体追问，背后折射的实则是日本首相高市早苗涉台错误言论触发的文化领域连锁震荡。一、事件核心脉络外交导火索日本首相高市早苗于11月7日公开宣称“台湾有事即日本存亡危机”，被中方认定为违反一个中国原则和中日政治文件精神的言论。外交部多次强调，该言论影响了中日交流氛围，要求日方纠正。,,,,外交部回应日本歌手演唱会被取消,0,0,0,2025-12-01 19:45,摄政螳螂iPhone 16,,,,,红V,超级会员,1
5239130487522680,QgpXGvyZy,7308140398,大象新闻,【#外交部回应日本又来碰瓷钓鱼岛#：挖空心思断章取义毫无说服力】#中方铁证如山驳斥日方非法主张#关于钓鱼岛的归属，日本又来碰瓷了！近日日本政府在东京“领土主权展示馆”内新增了三份所谓“证明钓鱼岛归属”的历史文件，试图证明日方涉钓鱼岛非法主张。自古以来，钓鱼岛及其附属岛屿就是中国的固有领土，这一事实，中方有充分的证据链。日本此番操作，只能解释为试图为窃取中国钓鱼岛的非法主张涂脂抹粉，是彻头彻尾的政治碰瓷与历史篡改表演。在今天下午外交部发布会上，发言人林剑表示，钓鱼岛及其附属岛屿自古以来就是中国的固有领土，这方面的证据，包括日本国内的外交档案、地图和历史学者文章比比皆是，日方挖空心思搜罗一些断章取义、毫无说服力的所谓“历史资料”，恰恰证明了日方的非法主张根本站不住脚，发言人用“比比皆是”四字，道破了中方在历史与法理上的压倒性优势。分析日本这项操作，此举绝非单纯的历史研究，而是配合其修宪扩军、突破战后秩序的系统性动作之一。高市早苗提出涉台错误言论后，不断加速武装介入台海、南海事务，如今公然捏造领土依据，恰恰显示着日本右翼势力正企图以“虚构主权”为突破口，彻底摆脱和平宪法约束，重走军事扩张老路。玩火者必自焚。日本若继续在钓鱼岛问题上进行政治操弄，不仅将严重破坏中日关系根基，更会将自己推向地区和平与稳定的对立面。中国维护领土主权的决心坚如磐石，任何伎俩都无法改变钓鱼岛属于中国这一铁的事实。（大象新闻记者北京报道）L大象新闻的微博视频,,,,"外交部回应日本又来碰瓷钓鱼岛,中方铁证如山驳斥日方非法主张",5,9,72,2025-12-01 19:45,微博视频号,,"http://f.video.weibocdn.com/o0/K7voRzuelx08tpG6YWFi01041200DFRM0E010.mp4?label=mp4_720p&template=720x1280.24.0&ori=0&ps=1BVp4ysnknHVZu&Expires=1765159104&ssig=WW6e7Nf0aI&KID=unistore,video",,,普通用户,超级会员,3
5239146231629999,Qgqn56Q2j,7871150305,空天之王,🔻台媒细数日本九宗罪，苑举正老师大胆预测中日60天内发生空战，不打下飞机日本不会服的#高市宣称日本又回来了##中日军事实力差距有多大##热点解析#中国一点都不能少超话#军事新闻#O网页链接,,,,"高市宣称日本又回来了,中日军事实力差距有多大,热点解析,军事新闻",0,0,1,2025-12-01 20:47,中国一点都不能少超话,,,,,金V,超级会员,2
5239146222457230,Qgqn4ajeK,7871150305,空天之王,🔻张竞气晕了，民进党对海鲲号泄密毫不在意！万美玲一艘海鲲号造价500亿，海试只做了浮航#高市宣称日本又回来了##中日军事实力差距有多大##热点解析#中国一点都不能少超话#军事新闻#L空天之王的微博视频,,,,"高市宣称日本又回来了,中日军事实力差距有多大,热点解析,军事新闻",1,0,4,2025-12-01 20:47,中国一点都不能少超话,,"http://f.video.weibocdn.com/o0/DJmgSAHPlx08tpKogvxm01041202wLRE0E010.mp4?label=mp4_720p&template=1280x720.25.0&ori=0&ps=1BVp4ysnknHVZu&Expires=1765159104&ssig=TlnZz8iNli&KID=unistore,video",,,金V,超级会员,2
5239146194667978,Qgqn1jAlY,7871150305,空天之王,🔻东京大规模抗议高市早苗，中国驻日本大使突然发声？#高市宣称日本又回来了##中日军事实力差距有多大##热点解析#中国一点都不能少超话#军事新闻#L空天之王的微博视频,,,,"高市宣称日本又回来了,中日军事实力差距有多大,热点解析,军事新闻",0,0,5,2025-12-01 20:47,中国一点都不能少超话,,"http://f.video.weibocdn.com/o0/FiUlumzYlx08tpKmtlvi01041205zqtd0E020.mp4?label=mp4_720p&template=1278x720.25.0&ori=0&ps=1BVp4ysnknHVZu&Expires=1765159104&ssig=DwcljRG2JT&KID=unistore,video",,,金V,超级会员,2
5239146190996835,Qgqn14bjZ,7871150305,空天之王,🔻日本国防预算再武装创新高解放军PHL-03火箭炮夺岛利器！#高市宣称日本又回来了##中日军事实力差距有多大##热点解析#中国一点都不能少超话#军事新闻#L空天之王的微博视频,,,,"高市宣称日本又回来了,中日军事实力差距有多大,热点解析,军事新闻",0,0,4,2025-12-01 20:47,中国一点都不能少超话,,"http://f.video.weibocdn.com/o0/msT4kOR8lx08tpKmeiqQ01041204bF8o0E020.mp4?label=mp4_720p&template=1280x720.25.0&ori=0&ps=1BVp4ysnknHVZu&Expires=1765159104&ssig=IF9lY5BgWx&KID=unistore,video",,,金V,超级会员,2
5239146172123583,QgqmZ8Url,7871150305,空天之王,🔻中俄同时对日施压取消日本艺人在东大的演出！#高市宣称日本又回来了##中日军事实力差距有多大##热点解析#中国一点都不能少超话#军事新闻#O网页链接,,,,"高市宣称日本又回来了,中日军事实力差距有多大,热点解析,军事新闻",0,0,1,2025-12-01 20:47,中国一点都不能少超话,,,,,金V,超级会员,2
5239146138567488,QgqmVzWNi,7871150305,空天之王,🔻亦真坚持主持节目是奔着养胎来的吧！张延廷解读日本备战西南诸岛真打起来撑不了3小时，解放军首轮就全清掉#高市宣称日本又回来了##中日军事实力差距有多大##热点解析#中国一点都不能少超话#军事新闻#L空天之王的微博视频,,,,"高市宣称日本又回来了,中日军事实力差距有多大,热点解析,军事新闻",0,0,4,2025-12-01 20:47,中国一点都不能少超话,,"http://f.video.weibocdn.com/o0/QyaKP1VUlx08tpKm5O7m01041202qG7x0E010.mp4?label=mp4_720p&template=1278x720.25.0&ori=0&ps=1BVp4ysnknHVZu&Expires=1765159104&ssig=eEriVdkZ26&KID=unistore,video",,,金V,超级会员,2
5239146055735803,QgqmNo48X,1831114323,少司命命,#外交部回应日本外相重复旧金山和约#高市早苗态度退缩真假？蔡正元：要回到波茨坦公告才算！#十分钟视频助燃计划#L少司命命的微博视频,,,,"外交部回应日本外相重复旧金山和约,十分钟视频助燃计划",0,0,0,2025-12-01 20:47,微博视频号,,"http://f.video.weibocdn.com/u0/ChedFd78gx08tpKjLrNS01041200Eoe70E010.mp4?label=mp4_720p&template=1280x720.25.0&ori=0&ps=1BVp4ysnknHVZu&Expires=1765159104&ssig=HPIpVb87I5&KID=unistore,video",,,金V,超级会员,1
5239145889010349,QgqmwBO0d,7871150305,空天之王,🔻日架电磁大锅防空警500张延廷：一开战这些都会被摧毁掉！#高市宣称日本又回来了##中日军事实力差距有多大##热点解析#中国一点都不能少超话#军事新闻#L空天之王的微博视频,,,,"高市宣称日本又回来了,中日军事实力差距有多大,热点解析,军事新闻",0,1,7,2025-12-01 20:46,中国一点都不能少超话,,"http://f.video.weibocdn.com/o0/7O2Scaollx08tpKhBYuQ01041201gu7d0E010.mp4?label=mp4_720p&template=1280x720.25.0&ori=0&ps=1BVp4ysnknHVZu&Expires=1765159104&ssig=82wIiqUmO2&KID=unistore,video",,,金V,超级会员,2
5239145857288125,QgqmtuzYp,2657835782,LifeEncyclopedia,同胞，请归！在日滞留的你，每一次打卡都可能是对家国尊严的消耗当日本在华企业开始结算员工工资、酝酿撤资，当数以万计的同胞经韩朝中转仍赴日旅游，当你还在东京大阪的街头大拍“和风写真”时，有一些事，是时候该清醒了。一、你的“逆风旅行”，正在给国家递刀中日关系正处于建交以来最紧绷的时刻：日本右翼政客频繁发表反华言论，涉华犯罪率持续上升，西南岛屿军演不断……在这样的敏感节点，外交部的安全提醒、民航局的免费退改票政策（覆盖率超90%），不是“限制自由”的枷锁，而是用无数情报和专家智慧筑起的安全防线。可偏偏有人，打着“行程早定”的旗号，在东京塔下拍和服照，在道顿崛吃拉面时发定位炫耀“日本挺友好”。你可知，日本政府正拿着你这些“岁月静好”的画面，对外包装“旅游友好国”形象，试图淡化中日紧张态势？你自以为的“旅行自由”，早已成了他们洗白的“活道具”。二、你的任性滞留，是对家国尊严的漠视联合国旅游组织2024年报告显示：政治敏感期坚持滞留的游客，遭遇安全事故的概率高出20%。这不是危言耸听——日本本土流感肆虐，机场人潮拥挤，传染病风险陡增；西南军演地带离热门景点不远，局势一触即发……更扎心的是，中国驻日使馆近期通报，因滞留游客擅自前往风险地区，已发生多起资源浪费的救援事件：有人无视提醒被困山区，最终动用大量外交资源营救，拖累了真正需要帮助的紧急事务。你在日本的“岁月静好”，是祖国在背后为你兜底的“负重前行”。三、家国大义前，旅行从来不是“小事”还记得郑伊健吗？他因顾及中日关系，毅然取消东京演唱会，赢得一片掌声。而你，却在国家与日本博弈的关键期，跑去日本消费、打卡，让外交反制的努力被自家同胞的消费力“稀释”。中日之间的历史伤痕，不是一顿寿司、一次打卡就能抹去的；中华民族的集体记忆，不该被你的几张旅行照轻描淡写。你站在日本的街头，就代表着中国人的形象——国际社会不会觉得你“自由洒脱”，只会认为这是中国公众对自家政府“不买账”的信号。这种误读一旦放大，受损的是全体中国人的尊严。四、同胞，请归！祖国永远是你最坚实的后盾旅游可以再去，尊严却不能重来。现在，中国驻日使领馆正连夜协调包机，旅游平台开出全额退款+补贴政策……祖国在用最大的诚意，接你回家。请记住：你不是一个人在旅行，你的身后是14亿同胞的家国情怀，是一个正在崛起的大国尊严。别让个人的一时欢愉，成为集体的舆论笑柄；别等国际社会的讽刺声响起，才后知后觉地后悔。此刻，成田机场、关西机场的同胞们，收拾好行囊吧。祖国的包机在等你，家里的热饭在等你，一个民族的尊严，更在等你用“归途”来捍卫。你在哪里，中国的形象就在哪里。此刻归来，才是对家国最深的眷恋。你我共勉爱出者爱返，福往者福来！承蒙您关注品读、转发点赞，更感念每份赞赏——钱多钱少皆是心意，这份支持最是珍贵！愿我们携手相伴，彼此成就，共赴前路！下次再会～LLifeEncyclopedia的微博视频,,,,,0,3,4,2025-12-01 20:46,iPhone客户端,,"http://f.video.weibocdn.com/o0/NDzfVAiblx08tpKhfcYE01041202bpTx0E010.mp4?label=mp4_720p&template=720x1280.24.0&ori=0&ps=1BVp4ysnknHVZu&Expires=1765159104&ssig=Msg2OL%2Bv4V&KID=unistore,video",,,普通用户,非会员,0
5239114833069153,QgpyrcSqt,2927625292,八极浮屠,像这样有影响力的日本人能主动站出来，客观分析高市早苗的发言，还是非常难得的这才是真正为了日本的前途着想。与邻为壑还是与邻为友，全在一念之间。一名真正的政治家应有宽阔的胸怀和长远的眼光，而不是只做昙花一现、偏安一隅的投机政客。#高市早苗##高市早苗让日本国家承担代价##中日关系#,,,,"高市早苗,高市早苗让日本国家承担代价,中日关系",0,0,0,2025-12-01 18:42,HUAWEI Mate 70 Pro,"https://wx1.sinaimg.cn/large/ae80044cgy1i7vl44g643j20u01skwkf.jpg,https://wx4.sinaimg.cn/large/ae80044cgy1i7vl44smkdj20u01skn2l.jpg",,,,普通用户,非会员,0
5239114666344779,QgpyaqCz9,7424993568,hoable,#赵雨凡中文说我爱你们#粉丝敢说第二天说中文，没有第一天舆论的影响吗？日本颁奖典礼可以说是文在中国颁奖典礼就不能说中文，说白了这就是态度问题，不是不能说，就是不想说，跟公司也没关系，他既然已经站在上面发言，他总不可能说一半，公司就派人把他拽下来，还说不闯中，说这话搞笑不？中日韩哪国花的钱最多，自己心里没数，错了就是错了，不要捂嘴。,,,,赵雨凡中文说我爱你们,0,0,1,2025-12-01 18:42,Xiaomi 14,,,,,普通用户,非会员,0
5239114099329197,QgpxfD8WV,6488114629,阿森正能量,高市最担心的事发生了#高市早苗涉台谬论严重冲击中日关系##一分钟视频创作季#L阿森正能量的微博视频,,,,"高市早苗涉台谬论严重冲击中日关系,一分钟视频创作季",1,6,30,2025-12-01 18:40,Android,,"http://f.video.weibocdn.com/o0/6CwogSBGlx08tpytqId201041201MBPI0E010.mp4?label=mp4_720p&template=720x1280.24.0&ori=0&ps=1BVp4ysnknHVZu&Expires=1765159124&ssig=XEkq6aYR6r&KID=unistore,video",,,金V,超级会员,2
5239114083602971,Qgpxef7ir,5885970382,文立103,小熊带你看世界:假如中日爆发冲突，解放军需要多久时间结束战争？O网页链接,,,,,0,0,0,2025-12-01 18:39,荣耀X30 5G,,,,,普通用户,非会员,0
5239113412252353,Qgpw99rWh,6987829540,源涵Roy,#什么样的日本又回来了#高市的冒险已触发东亚安全链式反应。军事专家警告，若日本执意复刻“大东亚共荣圈”旧梦，琉球独立运动可能因势再起，而中日一旦开战，日本自卫队仅能支撑一周——军国主义归途的尽头，唯有深渊。,,,,什么样的日本又回来了,0,5,6,2025-12-01 18:37,真我V13 5G,,,,,黄V,会员,6
5239113223506230,QgpvQeI86,8006070827,ABC天花板,世界静默等待东方巨人出招！日本产业窒息前的绝望赌局，正成中国世纪大考全球冲突暂歇，所有目光聚焦东亚。日本并非受人指使，而是面对新能源汽车等产业被中国全面碾压的绝境，赌上国运进行最后一搏，企图绑架美国、搅乱局势。周边国家屏息观望：若中国以雷霆手段压制日本挑衅，东南亚等“墙头草”将倒向东方；若示弱，饿狼便将蜂拥而至。日本自卫队战争准备全面铺开，在琉球部署导弹，狼子野心昭然若揭。中国坚守底线，正告日方恪守中日四个政治文件原则，勿在错误道路上越走越远。这场博弈，关乎未来百年区域秩序，中国已严阵以待。LABC天花板的微博视频,,,,,21,17,219,2025-12-01 18:36,微博视频号,,"http://f.video.weibocdn.com/o0/sfdqPgPUlx08tpBmgwVW01041200iGRZ0E010.mp4?label=mp4_720p&template=720x1558.24.0&ori=0&ps=1BVp4ysnknHVZu&Expires=1765159124&ssig=CN0ZUeWBqf&KID=unistore,video",,,金V,超级会员,2
5239112418204675,Qgpuxyqpt,5901414562,桂尚投资,为何日本唯独不惧怕中国？公元663年8月，中日白江口海战，日本大败。1231年后中日甲午战争，日本完胜，签《马关条约》，中国共计损失约3.5亿两白银。1931年9月18日，日本蓄意制造侵华战争，4个多月占领东北全境，3000多万东北同胞沦为亡国奴。七七事变，又是日本蓄意挑起的侵华战事，八年抗战我军民伤亡3587.9万余人。白江口海战日本隐忍千余年，至甲午战争大败清朝海军，日本民族何等可怕。剥掉日本人的外皮，除下它的漆层，露出来的是海盗。司马光《资治通鉴》谈日本民族：“知小礼而无大义，拘小节而无大德，重末节而轻廉耻，畏威而不怀德，强必盗寇，弱必卑伏。”罗斯福曾说：“日本是有史以来我见过的最卑鄙、最无耻的民族。”基辛格认为：“日本人的野心是由来已久的，没有一个战略家真正读懂了日本人的野心。”卑伏了八十年，高市露尾巴了。,,,,,0,0,0,2025-12-01 18:33,荣耀Play5T活力版,,,,,普通用户,会员,3
5239112329855656,QgpuoFlUc,1624195875,战刀007,美媒曝料：高市早苗在电话里被警告：不要招惹中方！近日，《华尔街日报》披露了一则引人关注的细节：美方在与中方通话后不久，随即致电高市早苗，要她“降低调门”，尤其在台海议题上“不要挑衅中方”。这一消息虽未被白宫或日本首相官邸正式证实，但结合最新的高市早苗表态，其可信度不容忽视。中方最近暂停了原定11月24日举行的中日韩文化部长会议，并同步宣布暂停进口日本部分水产品和牛肉——这些品类2024年对华出口额合计超过12亿美元，占日本农产品出口总额的近三成。而且在11月18日至22日期间，中方连续组织在黄海开展实弹演训，涵盖海空联合打击、远程精确制导武器试射等课目。从美日关系角度看，美国虽鼓励盟友牵制中方，但绝不希望因日本单方面激进行动引发不可控冲突。《华尔街日报》所曝料的这些细节，极可能是真的。美方不希望日本破坏好不容易缓和的中美关系。所以，高市早苗归根结底只是一个棋子，而棋子是无法左右棋手的。,,,,,9,25,124,2025-12-01 18:33,微博网页版,https://wx2.sinaimg.cn/large/60cf4323ly1i7vfcukl30j20h40bawi0.jpg,,,,金V,超级会员,3
5239112269301447,QgpuiD1Jl,1499104401,新浪军事,#日本国宝级歌手要求高市撤回言论#【日本国宝级歌手：“希望高市爽快一点”】据日本《中日体育》网站11月30日报道，今年已经81岁高龄的日本国宝级歌手加藤登纪子11月30日参加了东京广播公司的“早安周日”节目，在谈及日本首相高市早苗围绕“台湾有事”的国会答辩引发中国激烈反制、日中关系陷入恶化的问题时，加藤登纪子明确要求高市撤回这一言论。报道称，在11月7日的众议院预算委员会会议上，高市声称“台湾有事”可能演变为日本的“存亡危机事态”。此言一出在日本国内外引发巨大争议。加藤登纪子在提及这一话题时表达了希望高市撤回发言的愿望。她说：“我想对高市首相说，虽然野田（立宪民主党代表野田佳彦）先生认为事实上首相已经撤回了发言，但我好像没听出来有这个意思。所以我希望高市首相能够再一次明确撤回她的言论。”加藤登纪子还说：“现在造成的结果好像在说，既然日本要增强防卫力，那么就算日本成为被攻击的目标也无所谓，这已经是在煽动危机了。”所以她再一次要求：“既然意识到已经造成了很大的影响，我希望她尽快收回她的言论，希望她爽快一点，赶紧转变态度。”#什么样的日本又回来了##高市早苗搂肩熊抱滑椅子#（参考消息）,,,,"日本国宝级歌手要求高市撤回言论,什么样的日本又回来了,高市早苗搂肩熊抱滑椅子",6,1,11,2025-12-01 18:32,微博网页版,https://wx1.sinaimg.cn/large/001Ds5xfgy1i7vkuewhbbj60j60asac902.jpg,,,,蓝V,超级会员,1
5238905326797546,Qgk6wswlQ,2770722975,每天读点正能量,持续反制日本，中日紧张关系持续影响航空市场据央视报道引述的最新数据显示，12月原计划执行的5548个中国飞往日本的航班中，904个已确定取消，取消比例达16%。日本首相高市早苗抛出涉台挑衅言论后，拒不撤回、拒不道歉，中方持续升级反制措施。中方接连发布赴日旅游、留学预警，暂停多领域交流，珠海航展icon拒绝日本相关人员入场。中国游客锐减让日本旅游业、零售业遭重创，相关产业损失惨重。中方立场明确：核心利益不容触碰，日方若坚不悔改，必将面临更严厉反制，为其错误言行付出更大代价。,,,,,1,0,2,2025-12-01 04:50,OPPO Find X8 Pro,"https://wx4.sinaimg.cn/large/a525e09fly1i7ux2tygxdj20vu13g7co.jpg,https://wx4.sinaimg.cn/large/a525e09fly1i7ux2u8xmgj20u00s4n3y.jpg",,,,普通用户,非会员,0
5238904124604736,Qgk4AjjTW,6421528583,YFLPC,【#高市错误言论被多国定性为高市谬论#】#高市错误言论被指违反国际关系准则#日本首相高市早苗近期发表的错误言论，被多国定性为违反国际关系准则的“高市谬论”，严重恶化中日交流氛围，遭到广泛批评，引起国际舆论广泛关注。一起看媒体观察↓（央视网）L新京报的微博视频,,,,"高市错误言论被多国定性为高市谬论,高市错误言论被指违反国际关系准则",0,0,1,2025-12-01 04:45,微博视频号,,"http://f.video.weibocdn.com/o0/eDDuakhblx08togCq4iI01041200RlCd0E010.mp4?label=mp4_720p&template=1280x720.25.0&ori=0&ps=1BVp4ysnknHVZu&Expires=1765160509&ssig=tPlGTDfSmh&KID=unistore,video",,,普通用户,会员,7
5238902919266516,Qgk2DCSDW,5355699024,百姓一席谈,中国从未入侵日本丨杰弗里·萨克斯G20峰会谈中日关系！！O网页链接,,,,,0,0,0,2025-12-01 04:40,荣耀70 Pro 5G,,,,,普通用户,非会员,0
5238902543614051,Qgk22fab9,6246446337,用户6246446337,11月30中日局势对峙已全面升级：外交博弈白热化，一起来听听O网页链接,,,,,0,0,0,2025-12-01 04:39,Redmi Note 13 Pro,,,,,普通用户,非会员,0
5238899486228645,QgjX6q8m1,2770722975,每天读点正能量,中日两国如今关系日渐严峻，在这个关头，一位日本自卫队的高管叫嚣，如果中日两国真的开始战争，日本公民也不要惊慌，在日本本土遇见中国军队的概率几乎为零。日本政府似乎如今已将赌变成了常态，赌在这一次的中日纷争中中国不会发起战争，赌中日一旦出现战争，背后的美国政府或许会来帮助日本对抗中国。或许更是在赌一旦中日两国发起战争，日本战败后只要回到日本本土便不会遭到中国的制裁，但却貌似没有想到如今的中国已经与之前大不相同了。昔日放日本一马不过是因为当时的中国国力不够强盛，可随着和平时代的到来，如今中国似乎已经有了翻天覆地的变化。一旦中日两国再起战争，中国军队或许会不留余力的对日本发起制裁，而一旦到了那个时候，日本所谓的回到本土便无事的想法或许便是无稽之谈。,,,,,0,0,0,2025-12-01 04:27,OPPO Find X8 Pro,https://wx2.sinaimg.cn/large/a525e09fly1i7uweo9825j20m00i6di3.jpg,,,,普通用户,非会员,0
5238899035341070,QgjWnmpsi,2770722975,每天读点正能量,中日关系因高市早苗扬言出兵台海而紧张。俄罗斯一位将军说，如果战争不可避免，那早打比晚打好，主动出击也有好处，不可守着打。话音未落，很多人已经想到日本，想到历史上日本对待中国的方式。日本在历史上曾对待中国犯下了严重的罪行，和平从不是妥协出来的，守好底线、强硬护权，才是对挑衅者最有力的警示，对历史最好的告慰！,,,,,0,0,0,2025-12-01 04:25,OPPO Find X8 Pro,https://wx3.sinaimg.cn/large/a525e09fly1i7uwcthx3ej20xs16waf2.jpg,,,,普通用户,非会员,0
