id,bid,user_id,用户昵称,微博正文,头条文章url,发布位置,艾特用户,话题,转发数,评论数,点赞数,发布时间,发布工具,微博图片url,微博视频url,retweet_id,ip,user_authentication,会员类型,会员等级
5239160672879782,QgqKnc5a6,7795599219,阿司匹灵-V元启,-中国A股总市值≈14万亿美元，前10里银行、石油、白酒、地产占大头，总和才2万亿出头，结构像“守护者联盟”，稳但重；-日本总市值≈6.4万亿美元（约953万亿日元），前10丰田、索尼、三菱领衔，总和1.5万亿，制造业精密但少野性，像一台老机器；-台湾总市值≈2.86万亿美元，前10台积电7080亿独大，其余鸿海、联发科、金融断档，总和1.09万亿，高度专注但赌注单一；三家加起来23.26万亿，还不如美国这10家公司。英伟达一家4.16万亿，直接秒杀中国整个A股，还剩近10万亿“找零”；美国Top10是日本的3倍多、台湾的7.5倍、中日台总和的近1倍。结构上，美国前8全是科技股，第9是价值投资老将，第10靠AI药挤进来——全链条覆盖AI、云、电商、芯片、自动驾驶；中日台呢？存量产业守家，AI渗透率低得像配角。,,,,,0,0,1,2025-12-01 21:45,微博网页版,,,,,普通用户,非会员,0
5239160593190419,QgqKfdnYn,7661205899,幽靈船盛亞,日本的輿論與社會共識基本上是把中國的一切都貶低。然後我真心希望本國要建立一種概念:1.日本在他內部輿論中，除非可以踩中國，否則不怎麼說唐代。2.高度仇恨，仇恨漢民族，漢文化。這也是真去看過日本的輿論與新聞後。我是真感覺不要去相信任何的中日友好論述。本國的親日者，大多是最惡劣的反華者。基本上牛鬼蛇神。對於華人圈中與日本流行文化，尤其傳統文化走近者，要防。要不陰濕，要不變態，要不反華，要不三者皆有。,,,,,26,64,412,2025-12-01 21:44,微博网页版,,,,,普通用户,会员,6
5239160228023929,QgqJExFod,7848577692,liuxin瞌睡虫,SEVENTEEN超话你说我们偷你们家奖，那你家应该很厉害了呀！为啥没得过总统勋章？为啥歌曲Notin？！！！！还有就是小心点，服兵役的时候别把假体打出来了！下家团超粉丝量真的是少的可怜，不能再可怜了！！居然还能再争3！一问就是不包括中日韩！！！粉丝发言，谁看谁不笑？,,,,,0,4,11,2025-12-01 21:43,SEVENTEEN超话,,,,,普通用户,非会员,0
5239159931277477,QgqJb5mkt,1765142974,66_ALUM,中日关系那么紧张的情况下我还能看到西原我也太幸运了🎹L66_ALUM的微博视频,,广州·MAO Livehouse广州(永庆坊店),,,0,0,0,2025-12-01 21:42,🍍iPhone客户端,,"http://f.video.weibocdn.com/u0/jFWHoJjYgx08tpO9aAvC010412037omh0E020.mp4?label=mp4_720p&template=1280x720.25.0&ori=0&ps=1BVp4ysnknHVZu&Expires=1765153252&ssig=QZqdzP6PF6&KID=unistore,video",,,普通用户,会员,8
5239159163981989,QgqHWgHTD,3820836334,高队,日本大阪议会全票要求中国驻大阪总领事道歉，只因总领事回击高市早苗涉台错误言论。中方早已明确，日本武力干涉台海即属侵略，中国可依法反制。中日争端有三种可能：最坏是日方强硬，解放军出手；最好是高市妥协道歉；或美方介入换高市下台，但治标不治本。中方仁至义尽，绝不容许日方越界挑衅。#日本软硬兼施企图复活军国主义##三分钟视频助燃计划##三分钟快速追热点#L高队的微博视频,,,,"日本软硬兼施企图复活军国主义,三分钟视频助燃计划,三分钟快速追热点",0,0,11,2025-12-01 21:39,微博视频号,,"http://f.video.weibocdn.com/o0/LRvyhWx9lx08tpNVgFVK01041201zUct0E010.mp4?label=mp4_720p&template=1280x720.25.0&ori=0&ps=1BVp4ysnknHVZu&Expires=1765153252&ssig=W1Zd6O%2BST8&KID=unistore,video",,,红V,超级会员,2
5239158324073092,QgqGAh5B2,7943742318,浪涛万里铸星河,台媒:连新加坡民众都不满黄循财支持日本，批黄忘记历史！#微博兴趣创作计划##微博中长视频扶持计划#L浪涛万里铸星河的微博视频,,,,"微博兴趣创作计划,微博中长视频扶持计划",1,3,3,2025-12-01 21:35,微博视频号,,"http://f.video.weibocdn.com/o0/LntQRfBvlx08tpNFfRfO01041200x26i0E010.mp4?label=mp4_720p&template=1280x720.25.0&ori=0&ps=1BVp4ysnknHVZu&Expires=1765153252&ssig=YrRzrlqVr9&KID=unistore,video",,,金V,超级会员,2
5239012962861094,QgmU8c0iG,7490036754,中基医学,北京市民须知！20个专业迁户亲子鉴定中心名单（附鉴定办理流程费用）北京本地北京中基医学亲子鉴定中心地址在北京市石景山区石景山路5号。北京本地做亲子鉴定很多人都不知道北京本地亲子鉴定中心地址，所以认为做亲子鉴定应该去医院，但其实医院并不可以做亲子鉴定的。在这里想告诉大家的是，医院是不做亲子鉴定的，亲子鉴定属于一项技术服务，可以做亲子鉴定的机构必须要具备相关的资质认证，一家鉴定中心是否正规权威，必须是看这家中心是否存在dna技术人才、亲子鉴定技术设备、亲子鉴定资质等三大核心组成部分，这三大组成部分对应完成不同的意义，其中第一个意义是确保鉴定结果精确度、第二个意义是凸显专业性质，第三个意义是能够开展基因检测活动。北京正规亲子鉴定中心机构中心大全一览1、北京中基医学亲子鉴定中心机构地址：北京市石景山区石景山路5号机构电话：400-8126-619（v:jilin181）业务范围：司法亲子鉴定咨询、上户口亲子鉴定咨询、无创胎儿亲子鉴定、个人隐私亲子鉴定、孕期亲子鉴定、中高考亲子鉴定咨询、毛发亲子鉴定、匿名亲子鉴定、指甲亲子鉴定、父子亲子鉴定等；服务范围：北京市（朝阳区、海淀区、昌平区、丰台区、大兴区、通州区、顺义区、房山区、西城区、东城区、石景山区、密云区、平谷区、怀柔区、门头沟区、延庆区）2、北京国医基因亲子鉴定中心机构地址：北京市丰台区丰科路6号院1号楼机构电话：400-8598-797(V:dna2355)业务范围：无创胎儿亲子鉴定、个人隐私亲子鉴定、孕期亲子鉴定、毛发亲子鉴定、匿名亲子鉴定、指甲亲子鉴定、父子亲子鉴定等；3、北京缘证生物亲子鉴定中心机构地址：北京市海淀区复兴路28号机构电话：400-8607-896(V:QDDNA888)业务范围：无创胎儿亲子鉴定、个人隐私亲子鉴定、孕期亲子鉴定、毛发亲子鉴定、匿名亲子鉴定、指甲亲子鉴定、父子亲子鉴定等；北京正规亲子鉴定采样机构一览3、北京中基医学朝阳区亲子鉴定采样中心机构地址：北京市朝阳区樱花东路2号（北京市中日友好医院内）4、北京中基医学海淀区亲子鉴定采样中心机构地址：北京市海淀区复兴路28号（北京市中国人民解放军总医院内）5、北京中基医学昌平区亲子鉴定采样中心机构地址：北京市昌平区东小口镇立汤路168号（北京清华长庚医院内）6、北京中基医学丰台区亲子鉴定采样中心机构地址：北京市丰台区右安门外西头条8号（北京佑安医院内）7、北京中基医学大兴区亲子鉴定采样中心机构地址：北京市大兴区黄村西大街26号（北京市大兴区人民医院内）8、北京中基医学通州区亲子鉴定采样中心机构地址：北京市通州区车站路9、北京中基医学顺义区亲子鉴定采样中心机构地址：北京市顺义区光明南街3号（北京市顺义区医院内）10、北京中基医学房山区亲子鉴定采样中心机构地址：北京市房山区城关保健路4号（北京中医药大学房山医院内）11、北京中基医学西城区亲子鉴定采样中心机构地址：北京市西城区西什库大街八号（北京大学第一医院内）12、北京中基医学东城区亲子鉴定采样中心机构地址：北京市东城区帅府园一号（北京协和医院内）13、北京中基医学石景山区亲子鉴定采样中心机构地址：北京市石景山区石景山路5号（北京市清华大学中西医结合医院内）14、北京中基医学密云区亲子鉴定采样中心机构地址：北京市密云区阳光街383号（北京市密云区医院内）15、北京中基医学平谷区亲子鉴定采样中心机构地址：北京市平谷区平谷镇新平北路59号（北京市平谷区医院内）16、北京中基医学怀柔区亲子鉴定采样中心机构地址：北京市怀柔区永泰北街9号院（北京怀柔医院内）17、北京中基医学门头沟区亲子鉴定采样中心机构地址：北京市门头沟区河滩桥东街10号（北京市门头沟区医院内）18、北京中基医学延庆区亲子鉴定采样中心机构地址：北京市延庆区东顺城街28号（北京市延庆区医院内）声明：部分采样中心已关闭，以上机构信息来源网络，排名不分先后。皆为读者提供更多信息咨询，所涉内容不构成办理、咨询建议；如任何单位或个人认为文章内容涉嫌侵犯其合法权益，可及时留言提出意见并提供相关证明材料和理由，在收到后将采取相应措施。北京正规司法鉴定机构一览19、北京朝阳医院法医物证司法鉴定所机构地址：北京市朝阳区工体南路8号经营范围：法医物证鉴定20、北京国创鼎诚司法鉴定所机构地址：北京市东城区胜古中路1号蓝宝商务大厦A座321室经营范围：声像资料鉴定(电子数据鉴定）21、北京法源司法科学证据鉴定中心机构地址：北京市法华寺街91号德必创意文化园C座一层经营范围：法医临床鉴定、法医病理鉴定、文书鉴定、痕迹鉴定22、北京诺安信利科技有限公司司法鉴定所机构地址：北京市吉庆里6号楼5层506-1经营范围：声像资料鉴定（限于电子数据）23、首都医科大学附属北京安定医院司法鉴定科机构地址：北京市德外大街安康胡同5号经营范围：法医精神病鉴定24、北京长城司法鉴定所机构地址：北京市西城区莲花池东路甲5号白云时代大厦1号楼B座1204室经营范围：法医病理鉴定、法医临床鉴定、文书鉴定、痕迹鉴定(手印鉴定）25、北京公大弘正医学研究院司法鉴定中心机构地址：北京市西城区莲花池东路白云时代大厦B座301经营范围：法医病理鉴定，法医临床鉴定，法医精神病鉴定，文书鉴定，痕迹鉴定，声像资料鉴定26、北京天平司法鉴定中心机构地址：北京市朝阳区八里庄西里100号住邦20001号楼B座1201经营范围：法医临床鉴定，法医物证鉴定27、北京中衡司法鉴定所机构地址：北京市朝阳区关东店28号经营范围：法医病理鉴定，法医精神病鉴定，法医临床鉴定，文书鉴定，声像资料鉴定(电子数据鉴定）28、北京博睿检测有限公司司法鉴定中心机构地址：北京市朝阳区左安门外饮马井45号10幢1层2号经营范围：法医精神病鉴定，法医毒物鉴定29、北京赛博威锋科技有限公司司法鉴定中心机构地址：北京市朝阳区安立路1号1幢一层60经营范围：声像资料鉴定（限电子数据）声明：以上机构信息来源网络，排名不分先后。皆为读者提供更多信息咨询，所涉内容不构成办理、咨询建议；如任何单位或个人认为文章内容涉嫌侵犯其合法权益，可及时留言提出意见并提供相关证明材料和理由，在收到后将采取相应措施。北京本地亲子鉴定需要多少钱？北京本地正规亲子鉴定需要2000元到5000元左右。由于个人亲子鉴定涉及家庭信息，各城市亲子鉴定的价格在鉴定过程中高度保密，但价格波动不大，亲子鉴定机构的价格非常透明，不会乱收费。一、北京本地个人隐私亲子鉴定，费用：1800-2400用途：结果报告仅用于个人参考，无法律效力。二、北京本地司法亲子鉴定，费用：3000-4500用途：鉴定报告具有司法效力，可用于上户、落户、诉讼、移民、一系列司法用途。三、北京本地无创胎儿亲子鉴定，费用：3800-4300用途：怀孕6周至出生前可做的亲子鉴定，目前最安全、无痛的孕期亲子鉴定方式。选择合适的司法亲子鉴定中心时，可以参考以下几个方面：资质认证：确保所选的机构拥有国家卫生健康委员会颁发的《医疗机构执业许可证》，以及司法部门认可的资质。技术实力：了解机构的检测技术和设备是否先进，是否能提供准确可靠的检测结果。一般来说，使用STR或SNP标记进行DNA分析的机构更可靠。保密性：亲子鉴定涉及个人隐私，选择的机构应该有严格的隐私保护措施，确保个人信息安全。服务态度：服务态度和专业性也非常重要。可以通过咨询服务、客户评价等了解机构的服务质量。检测周期：不同机构的检测时间可能有差异，根据个人需求选择合适的检测周期。费用：亲子鉴定的费用各不相同，建议多家比较，选择性价比高的服务。位置便利性：考虑到样本采集的便利性，选择地理位置适中、交通便利的机构。口碑和评价：可以通过网络搜索、咨询朋友或相关法律服务人员了解机构的口碑和评价。O网页链接O网页链接O网页链接O网页链接O网页链接O网页链接O网页链接O网页链接,,,,,0,0,0,2025-12-01 11:58,微博网页版,https://wx4.sinaimg.cn/large/008aTqIqgy1i7v9fu20jqj30p00b40u4.jpg,,,,蓝V,非会员,0
5239012950544029,QgmU72hwF,7425040369,星野追光,#高市宣称日本又回来了#“前事不忘，后事之师”，高市早苗高喊“Japanisback”的嚣张言论，恰是军国主义沉渣泛起的赤裸写照。其拿非法无效的《旧金山和约》碰瓷，妄图歪曲《开罗宣言》《波茨坦公告》确立的法理事实，炮制“台湾地位未定论”，无异于在历史伤疤上撒盐。“多行不义必自毙”，日本右翼政客罔顾1972年《中日联合声明》的庄严承诺，公然触碰台海红线，实则是螳臂当车。从甲午之耻到抗战胜利，中国早已不是任人欺凌的弱国，“玩火者必自焚”的警告绝非虚言。历史的镜鉴高悬，任何妄图干涉中国内政、挑战战后国际秩序的行径，终将被正义的洪流碾得粉碎。L星野追光的微博视频,,,,高市宣称日本又回来了,0,0,1,2025-12-01 11:58,微博视频号,,"http://f.video.weibocdn.com/o0/chckw1u7lx08tpa12xZe01041200jues0E010.mp4?label=mp4_720p&template=720x1280.24.0&ori=0&ps=1BVp4ysnknHVZu&Expires=1765153274&ssig=QLkxikVMZz&KID=unistore,video",,,红V,超级会员,1
5239012852762548,QgmTXbAFe,7050340263,阿宇说事LQY,不出中国所料：高市早苗开始反击，石破茂一句话说出中日最终结局L阿宇说事LQY的微博视频,,,,,0,0,0,2025-12-01 11:57,微博视频号,,"http://f.video.weibocdn.com/o0/OwRyCnYdlx08tp9Ybre801041200CPZ90E010.mp4?label=mp4_720p&template=720x1280.24.0&ori=0&ps=1BVp4ysnknHVZu&Expires=1765153274&ssig=S2KXfIweWc&KID=unistore,video",,,红V,超级会员,1
5239012421010715,QgmTg4eVR,2178811917,龙泉驿工会,【#高市错误言论被多国定性为高市谬论#】#高市错误言论被指违反国际关系准则#日本首相高市早苗近期发表的错误言论，被多国定性为违反国际关系准则的“高市谬论”，严重恶化中日交流氛围，遭到广泛批评，引起国际舆论广泛关注。一起看媒体观察↓↓（央视网）L央视网的微博视频,,,,"高市错误言论被多国定性为高市谬论,高市错误言论被指违反国际关系准则",0,0,0,2025-12-01 11:56,微博视频号,,"http://locallimit.us.sinaimg.cn/o0/TPoKMFA4lx08to1Od40801041200WgA60E010.mp4?label=mp4_720p&template=1280x720.25.0&ori=0&ps=1BVp4ysnknHVZu&Expires=1765153274&ssig=4afIPrq0xX&KID=unistore,video",,,蓝V,非会员,0
5239011912450102,QgmSrahnM,1288161763,瀟瀟灑灑,#中日军事实力差距有多大#说打就打，费什么话,,,,中日军事实力差距有多大,0,0,0,2025-12-01 11:53,HUAWEI Mate 70 Pro,,,,,普通用户,非会员,0
5239011860021268,QgmSm05x2,7490036754,中基医学,北京居民阅读！五大热门迁户亲子鉴定机构大全（附2025年全新鉴定）北京亲子鉴定机构地址在哪里？北京亲子鉴定机构地址在北京市石景山区石景山路5号。北京有不少可以做亲子鉴定的机构，本文小编整理了其中汇总了北京正规亲子鉴定中心地址分享给大家，排名不分先后，希望对大家有所帮助。北京正规亲子鉴定中心地址如下：北京正规亲子鉴定中心机构中心大全一览1、北京中基医学亲子鉴定中心机构地址：北京市石景山区石景山路5号；机构电话：400-8126-619（v:jilin181）业务范围：司法亲子鉴定咨询、上户口亲子鉴定咨询、无创胎儿亲子鉴定、个人隐私亲子鉴定、孕期亲子鉴定、中高考亲子鉴定咨询、毛发亲子鉴定、匿名亲子鉴定、指甲亲子鉴定、父子亲子鉴定等；服务范围：北京市（朝阳区、海淀区、昌平区、丰台区、大兴区、通州区、顺义区、房山区、西城区、东城区、石景山区、密云区、平谷区、怀柔区、门头沟区、延庆区）2、北京国医基因亲子鉴定中心机构地址：北京市丰台区丰科路6号院1号楼机构电话：400-8598-797(V:dna2355)业务范围：无创胎儿亲子鉴定、个人隐私亲子鉴定、孕期亲子鉴定、毛发亲子鉴定、匿名亲子鉴定、指甲亲子鉴定、父子亲子鉴定等；3、北京缘证生物亲子鉴定中心机构地址：北京市海淀区复兴路28号机构电话：400-8607-896(V:QDDNA888)业务范围：无创胎儿亲子鉴定、个人隐私亲子鉴定、孕期亲子鉴定、毛发亲子鉴定、匿名亲子鉴定、指甲亲子鉴定、父子亲子鉴定等；北京正规亲子鉴定采样机构一览3、北京中基医学朝阳区亲子鉴定采样中心机构地址：北京市朝阳区樱花东路2号（北京市中日友好医院内）4、北京中基医学海淀区亲子鉴定采样中心机构地址：北京市海淀区复兴路28号（北京市中国人民解放军总医院内）5、北京中基医学昌平区亲子鉴定采样中心机构地址：北京市昌平区东小口镇立汤路168号（北京清华长庚医院内）6、北京中基医学丰台区亲子鉴定采样中心机构地址：北京市丰台区右安门外西头条8号（北京佑安医院内）7、北京中基医学大兴区亲子鉴定采样中心机构地址：北京市大兴区黄村西大街26号（北京市大兴区人民医院内）8、北京中基医学通州区亲子鉴定采样中心机构地址：北京市通州区车站路9、北京中基医学顺义区亲子鉴定采样中心机构地址：北京市顺义区光明南街3号（北京市顺义区医院内）10、北京中基医学房山区亲子鉴定采样中心机构地址：北京市房山区城关保健路4号（北京中医药大学房山医院内）11、北京中基医学西城区亲子鉴定采样中心机构地址：北京市西城区西什库大街八号（北京大学第一医院内）12、北京中基医学东城区亲子鉴定采样中心机构地址：北京市东城区帅府园一号（北京协和医院内）13、北京中基医学石景山区亲子鉴定采样中心机构地址：北京市石景山区石景山路5号（北京市清华大学中西医结合医院内）14、北京中基医学密云区亲子鉴定采样中心机构地址：北京市密云区阳光街383号（北京市密云区医院内）15、北京中基医学平谷区亲子鉴定采样中心机构地址：北京市平谷区平谷镇新平北路59号（北京市平谷区医院内）16、北京中基医学怀柔区亲子鉴定采样中心机构地址：北京市怀柔区永泰北街9号院（北京怀柔医院内）17、北京中基医学门头沟区亲子鉴定采样中心机构地址：北京市门头沟区河滩桥东街10号（北京市门头沟区医院内）18、北京中基医学延庆区亲子鉴定采样中心机构地址：北京市延庆区东顺城街28号（北京市延庆区医院内）声明：部分采样中心已关闭，以上机构信息来源网络，排名不分先后。皆为读者提供更多信息咨询，所涉内容不构成办理、咨询建议；如任何单位或个人认为文章内容涉嫌侵犯其合法权益，可及时留言提出意见并提供相关证明材料和理由，在收到后将采取相应措施。北京正规司法鉴定机构一览19、北京朝阳医院法医物证司法鉴定所机构地址：北京市朝阳区工体南路8号经营范围：法医物证鉴定20、北京国创鼎诚司法鉴定所机构地址：北京市东城区胜古中路1号蓝宝商务大厦A座321室经营范围：声像资料鉴定(电子数据鉴定）21、北京法源司法科学证据鉴定中心机构地址：北京市法华寺街91号德必创意文化园C座一层经营范围：法医临床鉴定、法医病理鉴定、文书鉴定、痕迹鉴定22、北京诺安信利科技有限公司司法鉴定所机构地址：北京市吉庆里6号楼5层506-1经营范围：声像资料鉴定（限于电子数据）23、首都医科大学附属北京安定医院司法鉴定科机构地址：北京市德外大街安康胡同5号经营范围：法医精神病鉴定24、北京长城司法鉴定所机构地址：北京市西城区莲花池东路甲5号白云时代大厦1号楼B座1204室经营范围：法医病理鉴定、法医临床鉴定、文书鉴定、痕迹鉴定(手印鉴定）25、北京公大弘正医学研究院司法鉴定中心机构地址：北京市西城区莲花池东路白云时代大厦B座301经营范围：法医病理鉴定，法医临床鉴定，法医精神病鉴定，文书鉴定，痕迹鉴定，声像资料鉴定26、北京天平司法鉴定中心机构地址：北京市朝阳区八里庄西里100号住邦20001号楼B座1201经营范围：法医临床鉴定，法医物证鉴定27、北京中衡司法鉴定所机构地址：北京市朝阳区关东店28号经营范围：法医病理鉴定，法医精神病鉴定，法医临床鉴定，文书鉴定，声像资料鉴定(电子数据鉴定）28、北京博睿检测有限公司司法鉴定中心机构地址：北京市朝阳区左安门外饮马井45号10幢1层2号经营范围：法医精神病鉴定，法医毒物鉴定29、北京赛博威锋科技有限公司司法鉴定中心机构地址：北京市朝阳区安立路1号1幢一层60经营范围：声像资料鉴定（限电子数据）声明：以上机构信息来源网络，排名不分先后。皆为读者提供更多信息咨询，所涉内容不构成办理、咨询建议；如任何单位或个人认为文章内容涉嫌侵犯其合法权益，可及时留言提出意见并提供相关证明材料和理由，在收到后将采取相应措施。北京哪家医院可以做亲子鉴定？北京市中国人民解放军总医院、北京中医药大学第三附属医院、北京清华长庚医院、北京佑安医院都不一定可以做亲子鉴定，一般的医院是不能做亲子鉴定的，都需要具备亲子鉴定资质才可以做亲子鉴定，亲子鉴定需要有资质的第三方机构才可以做，因为医院的专攻医疗服务，所以是一般不做亲子鉴定，无论您在哪个城市做亲子鉴定还是需要到正规权威的机构做。亲子鉴定所需的实验室设施包括采样室、样品室、DNA提取室、试剂储存、准备室、扩增及检测室，而这些条件并非一般医院所具备。此外，医院不进行亲子鉴定的原因还包括：无法满足客户对隐私保护的要求；人力资源分配不够合理，可能导致医院对紧急求救电话的响应不及时等。因此，在寻找亲子鉴定服务时，选择专业的第三方机构是更佳的选择。北京亲子鉴定费用详情：北京司法亲子鉴定费用3000-4500一次司法亲子鉴定是指需要把鉴定报告提供给法院、公安机关、公证处以及出入境管理处等司法机构的一种鉴定，司法亲子鉴定报告具有法律效力，可以作为证据使用。司法鉴定活动必须遵循诉讼法及有关司法解释进行，程序违法的鉴定结论不能成为鉴定材料。司法亲子鉴定的结果可以用于上户口、打官司、出国等用途。北京个人隐私亲子鉴定费用1800-2400一次个人亲子鉴定无需任何证明即可进行办理鉴定，不公开，只供委托人知道结果。你有权选择不出示任何证件。可以自己取样送鉴定中心，也可以直接去鉴定中心由工作人员取样。个人亲子鉴定仅仅是用于确认亲子关系，了解是否是亲生。北京无创胎儿亲子鉴定费用3800-4300一次无创产前胎儿亲子鉴定怀孕满6个星期及以上且孕妇身体无恙即可做，只需抽取孕妇手臂10ml静脉血从中抽取胎儿DNA样本信息与疑父进行亲子鉴定，也可以选择自行委托医院护士采样、预约鉴定中心工作人员上门采样、或到鉴定中心现场免费采样，一般5-7天出结果发报告。无创胎儿亲子鉴定可提前了解胎儿的亲生父亲。O网页链接O网页链接O网页链接O网页链接O网页链接O网页链接O网页链接O网页链接,,,,,0,0,0,2025-12-01 11:53,微博网页版,https://wx3.sinaimg.cn/large/008aTqIqgy1i7v9b9swbfj30nc0dcab1.jpg,,,,蓝V,非会员,0
