id,bid,user_id,用户昵称,微博正文,头条文章url,发布位置,艾特用户,话题,转发数,评论数,点赞数,发布时间,发布工具,微博图片url,微博视频url,retweet_id,ip,user_authentication,会员类型,会员等级
5239186646896261,QgrqgsW21,1808765432,山外青山的楼-,关于近期台海局势，我用七句话回复我的朋友们：1、因为政治体制的原因，日本政客对话表示强硬，是为了拉票提高支持率；2、日本被美国钳制，美国给日本套上了狗链子，既要日本挑衅中国，又担心日本不可控；3、日本希望中美大战，不愿意看到中美关系缓和，而特朗普多次表明不愿意介入台海，日本很恐慌（两岸统一以后，第一岛链就消失了，损害日本战略利益）；4、二战秩序是五个常任理事国制定的，如果“台湾有事就是日本有事”，就是否定了波茨坦公告，这是美国也不愿意看到的。所以前几天特朗普打电话给搞事早苗，让她低调行事。5、美国总体上不愿意与中国正面开战，一旦打起来，美国会失去西太平洋霸权地位，美国自身处于债务危机，自身焦头烂额；（美国其实连阿富汗、委内瑞拉也搞不定，打仗不仅仅靠军事）；6、台湾问题涉及到中国核心利益，中国会玩命，谁干涉就毁灭谁；而对于美国，台湾距离美国太远，不是美国的核心利益。7、中日之间，军事实力差距大，雷达、军舰、导弹、坦克都有代差，更不要说战略核武器。（日本有制造核武器的能力，但是美国爸爸肯定不同意，这一点，中美肯定有默契）#日本介入台海即是侵略##日本敢介入台海吗#,,北京,,"日本介入台海即是侵略,日本敢介入台海吗",0,0,1,2025-12-01 23:28,HUAWEI Mate X2,"https://wx4.sinaimg.cn/large/6bcf91f8ly1i7vtc1fm20j20u019zjvp.jpg,https://wx4.sinaimg.cn/large/6bcf91f8ly1i7vtc2bh8qj20u01fvn5v.jpg,https://wx4.sinaimg.cn/large/6bcf91f8ly1i7vtc2prhuj20u0134tbc.jpg",,,,普通用户,非会员,0
5239181132438759,QgrhnaeqP,6379435287,菌武视界,#日本朝野磨刀霍霍#台媒:从安倍到高市早苗跨越十年的准备，日本要重启武装！#烽火问鼎计划#L菌武视界的微博视频,,,,"日本朝野磨刀霍霍,烽火问鼎计划",0,0,4,2025-12-01 23:06,微博视频号,,"http://f.video.weibocdn.com/o0/nl9SosN3lx08tpTTMfwk01041202nwmf0E010.mp4?label=mp4_720p&template=1280x720.25.0&ori=0&ps=1BVp4ysnknHVZu&Expires=1765124414&ssig=eIbGY8aWzh&KID=unistore,video",,,金V,超级会员,2
5239180868190409,QgrgWymHn,2132687523,晨心橙意的小坚果,王毅超话王毅谈中美关系：中国做的好不好，中国人民最有发言权，我们绝不接受毫无根据的指责摸黑！L晨心橙意的小坚果的微博视频,,,,,8,6,107,2025-12-01 23:05,王毅超话,,"http://f.video.weibocdn.com/u0/AYQ7AEzPgx08tpTOHzLW010412003V8X0E010.mp4?label=mp4_720p&template=720x1200.24.0&ori=0&ps=1BVp4ysnknHVZu&Expires=1765124414&ssig=GPTCAJZiAK&KID=unistore,video",,,红V,超级会员,2
5239180327129260,Qgrg4tUE4,2181597154,俄罗斯卫星通讯社,【中美博弈新“战场”？中式餐饮连锁为何此刻大举涌入美国】随着#中国#国内经济增长放缓、市场竞争白热化，众多本土企业开始寻求海外生机，餐饮业正是其中备受瞩目的领域。中国品牌正瞄准国际市场，尤其是#美国#，期待找到更稳定、利润更高的需求。然而，这一商业扩张恰逢中美经济关系持续紧张，使其不可避免地蒙上了一层政治色彩。中式连锁餐厅在美国城市的出现，已不仅是商业现象，更被视为中美全球竞争的一个象征。#中美关系#🔸尽管两国经济关系紧张，却并未阻挡中国快餐与茶饮连锁店以前所未有的规模进军美国市场。这是此类品牌首次如此集中、大规模地涌入美国。🔸一些在中国拥有数千家门店的品牌，正试图通过向美国城市扩张来摆脱国内困局。自2023年起，喜茶已在美开设数十家门店，包括纽约时代广场旗舰店；竞争对手霸王茶姬和奈雪的茶也于今年开设了美国首店。门店数星巴克三倍的瑞幸咖啡，已在曼哈顿布局多家咖啡馆；拥有超两万家门店的华莱士，已在加州开出首店；早在美经营的海底捞，也正加速扩张步伐。🔸它们“出海”的背后，是中国餐饮业正面临的严峻挑战：经济增速放缓、消费需求疲软、房地产危机持续。为了生存，连锁品牌被迫卷入激烈的价格战。🔸虽然中国餐饮连锁也在拓展其他海外市场（尤其在亚洲），但专家认为，美国市场依然独特——它是唯一在成熟度与规模上可与中国媲美的市场。然而，进入美国并非易事。中国品牌必须在被视为“经济竞争对手”甚至“敌对势力”的地缘政治环境下谨慎行事。尽管品牌全球化常被视作中国进步的标志，但在美国，这可能引发本地企业的警觉与担忧。🔸《纽约时报》文章同时指出一个对照现象：在中国连锁涌入美国之际，许多曾活跃于中国的美国品牌正在收缩其在华业务。例如，星巴克已将中国业务的控股权出售给博裕资本，而汉堡王的母公司则将其大部分中国资产转让给了一家中国私募股权公司。,,,,"中国,美国,中美关系",7,4,14,2025-12-01 23:03,微博网页版,https://wx2.sinaimg.cn/large/002nDL4Sgy1i7vscoiljjj60k00b4wfo02.jpg,,,,蓝V,超级会员,2
5239179653157952,QgreZdfwI,6379435287,菌武视界,#高市早苗被爆花8384万日元仍惨败#台媒:高市早苗民调不降反升到75%，大陆还需要加强力度！#烽火问鼎计划#L菌武视界的微博视频,,,,"高市早苗被爆花8384万日元仍惨败,烽火问鼎计划",0,0,3,2025-12-01 23:00,微博视频号,,"http://f.video.weibocdn.com/o0/ULmYoEX3lx08tpTuPIje01041202vmha0E010.mp4?label=mp4_720p&template=1278x720.25.0&ori=0&ps=1BVp4ysnknHVZu&Expires=1765124414&ssig=QX0WwL2dB5&KID=unistore,video",,,金V,超级会员,2
5239175244944885,Qgr7SkKod,1869723825,豪斯有料,每周投资展望12.01-12.05财经超话这里是#财经观察官#财豪斯的每周展望时间。上周受流感困扰，更新均延迟一天。微博基金的实盘持仓。本周持仓未变化：现持有30%黄金ETF，30%长久期美债基金，20%恒生互联ETF，20%A股科技基金。本周展望：1️⃣大A继续盘整态势。本周需要关注，是否能够线上3900，并突破50日均线的压制。如果能够突破50日均线，上看4000。否则也可能在3900上下盘整。如果50日均线，压制较强，最低可能测试上上周低点3820。年底人民币可能有结汇需求，推动人民币汇率走高，一定程度上提高了大A吸引力，跌破3820的概率不大。2️⃣港股恒生25000的大底真的是没什么可说的。加上今天放量反弹，底部特征相比大A明显的多。在美联储降息预期之下，可以期待港股中长期的表现。3️⃣黄金黄金的阻力位在4250。需要警惕如果12月降息预期暂时落空，可能会引发回调。除非发生大的事件，年内不可能突破4400，像白银一样创出历史新高。虽然周末三位大V的圆桌会议不那么看好黄金，也许是大V看到了我们普通人不知道的一些消息。但是黄金牛市是否能持续的一个基本逻辑是，美元的危机是否基本得到解除？不管是通过内部科技AI使得美国经济软着陆，还是外部因素中美关系缓和，长久期美债买家有着落。都没有特别明确的信号。黄金可以继续持有，关注央行购金进度。4️⃣美债美债看法不变。主要受流动性改善和美元降息预期改变的影响，维持10年美债以4.0为中枢进行波动的判断。降息周期下，美债是一个非常好的配置品种。5️⃣美股近一周两次探底，深V反弹基本可以确定。谨慎看多。本周美联储降息预期打得比较满，一定程度上支撑了黄金，港股，美股等资产保持向上趋势。需要警惕靴子落地或者预期落空产生的短期回调。微博实盘链接如下，可观察交易明细。@财豪斯的基金实盘专栏·每周财经观察,,,财豪斯,财经观察官,0,8,26,2025-12-01 22:43,,,,,,红V,超级会员,1
5239174514870947,Qgr6Hkr9F,7309264690,麻清楚,中美交流蜜月期的典范之作，“黑鹰直升机”#上微博涨知识##冷知识百科#L麻清楚的微博视频,,,,"上微博涨知识,冷知识百科",0,0,1,2025-12-01 22:40,微博视频号,,"http://f.video.weibocdn.com/u0/l3Y1n7QIgx08tpS5mkpa01041200MeXJ0E010.mp4?label=mp4_720p&template=720x1280.24.0&ori=0&ps=1BVp4ysnknHVZu&Expires=1765124414&ssig=SYNcnajclW&KID=unistore,video",,,金V,超级会员,1
5239165994402859,QgqSXitnR,3820836334,高队,得道多助，失道寡助，这是国际社会的不变法则。日本近年的一系列不当行径，让其在国际舞台上愈发孤立。无视国际共识、违背公平正义的做法，终究难以获得各国认同。失去信任与支持的代价，正在让日本逐渐偏离国际主流，唯有秉持正道、尊重他国，才能真正融入世界大家庭。#玩火者必自焚##三分钟视频助燃计划##三分钟快速追热点#L高队的微博视频,,,,"玩火者必自焚,三分钟视频助燃计划,三分钟快速追热点",0,2,25,2025-12-01 22:06,微博视频号,,"http://f.video.weibocdn.com/o0/mPzPKu0dlx08tpPKDzMs01041200RoJJ0E010.mp4?label=mp4_720p&template=1280x720.25.0&ori=0&ps=1BVp4ysnknHVZu&Expires=1765124414&ssig=LAwfqJAVHN&KID=unistore,video",,,红V,超级会员,2
